[
  {
    "fullName": "HKUDS/DeepTutor",
    "url": "https://github.com/HKUDS/DeepTutor",
    "description": "DeepTutor: Lifelong Personalized Tutoring. https://deeptutor.info/.",
    "language": "python",
    "stars": 51047,
    "starsInPeriod": 1930,
    "forks": 6263,
    "rank": 1,
    "source": "trending-html"
  },
  {
    "fullName": "obra/superpowers",
    "url": "https://github.com/obra/superpowers",
    "description": "An agentic skills framework \u0026 software development methodology that works.",
    "language": "shell",
    "stars": 308969,
    "starsInPeriod": 1034,
    "forks": 27480,
    "rank": 2,
    "source": "trending-html"
  },
  {
    "fullName": "pbakaus/impeccable",
    "url": "https://github.com/pbakaus/impeccable",
    "description": "The design vocabulary for your coding agent. Steer with polish and bolder, review with critique and audit, catch AI slop before it ships.",
    "language": "rust",
    "stars": 96134,
    "starsInPeriod": 2870,
    "forks": 5655,
    "rank": 3,
    "source": "trending-html"
  },
  {
    "fullName": "JetBrains/thinkrail",
    "url": "https://github.com/JetBrains/thinkrail",
    "description": "Vibe code with pi in a lightweight, real IDE that customises itself around the way you work — The Vibe You Need",
    "language": "typescript",
    "stars": 6257,
    "starsInPeriod": 1117,
    "forks": 339,
    "rank": 4,
    "source": "trending-html"
  },
  {
    "fullName": "milind-soni/OpenMausBot",
    "url": "https://github.com/milind-soni/OpenMausBot",
    "description": "Open-source Grok Bot alternative with a virtual machine that bots can use",
    "language": "typescript",
    "stars": 7809,
    "starsInPeriod": 1199,
    "forks": 1141,
    "rank": 5,
    "source": "trending-html"
  },
  {
    "fullName": "nightly-labs/openbot",
    "url": "https://github.com/nightly-labs/openbot",
    "description": "A local-first desktop workspace for persistent AI teammates. Run Codex, Claude, and Grok with dedicated workspaces, task queues, file sharing, browser control, and agent-to-agent collaboration.",
    "language": "typescript",
    "stars": 4090,
    "starsInPeriod": 709,
    "forks": 373,
    "rank": 6,
    "source": "trending-html"
  },
  {
    "fullName": "elayadesign/ai-design-skills",
    "url": "https://github.com/elayadesign/ai-design-skills",
    "language": "unknown",
    "stars": 12579,
    "starsInPeriod": 1187,
    "forks": 916,
    "rank": 7,
    "source": "trending-html"
  },
  {
    "fullName": "thedotmack/claude-mem",
    "url": "https://github.com/thedotmack/claude-mem",
    "description": "Persistent Context Across Sessions for Every Agent – Captures everything your agent does during sessions, compresses it with AI, and injects relevant context back into future sessions. Works with Claude Code, OpenClaw, Codex, Gemini, Hermes, Copilot, OpenCode + More",
    "language": "typescript",
    "stars": 105158,
    "starsInPeriod": 336,
    "forks": 9266,
    "rank": 8,
    "source": "trending-html"
  },
  {
    "fullName": "CopilotKit/OpenBot",
    "url": "https://github.com/CopilotKit/OpenBot",
    "description": "Open-source AI coworkers that each get a computer of their own: a browser, files and tools, with every action decided before it happens and recorded after. Bring any AG-UI agent.",
    "language": "typescript",
    "stars": 8386,
    "starsInPeriod": 247,
    "forks": 1064,
    "rank": 9,
    "source": "trending-html"
  },
  {
    "fullName": "togg53192-cmd/jailbreaks",
    "url": "https://github.com/togg53192-cmd/jailbreaks",
    "description": "LIST OF ALL MY JAILBREAKS",
    "language": "unknown",
    "stars": 9704,
    "starsInPeriod": 1594,
    "forks": 1354,
    "rank": 10,
    "source": "trending-html"
  },
  {
    "fullName": "Donchitos/Claude-Code-Game-Studios",
    "url": "https://github.com/Donchitos/Claude-Code-Game-Studios",
    "description": "Turn Claude Code into a full game dev studio — 49 AI agents, 72 workflow skills, and a complete coordination system mirroring real studio hierarchy.",
    "language": "shell",
    "stars": 29762,
    "starsInPeriod": 353,
    "forks": 4083,
    "rank": 11,
    "source": "trending-html"
  }
]
