[
  {
    "fullName": "astral-sh/uv",
    "url": "https://github.com/astral-sh/uv",
    "description": "An extremely fast Python package and project manager, written in Rust.",
    "language": "rust",
    "stars": 45000,
    "starsInPeriod": 1200,
    "forks": 900,
    "rank": 1,
    "source": "trending-html"
  },
  {
    "fullName": "openai/openai-go",
    "url": "https://github.com/openai/openai-go",
    "description": "The official Go library for the OpenAI API.",
    "language": "go",
    "stars": 3200,
    "starsInPeriod": 340,
    "forks": 180,
    "rank": 2,
    "source": "trending-html"
  },
  {
    "fullName": "danielmiessler/fabric",
    "url": "https://github.com/danielmiessler/fabric",
    "description": "A framework for using AI to augment human capabilities.",
    "language": "go",
    "stars": 29000,
    "starsInPeriod": 520,
    "forks": 4100,
    "rank": 3,
    "source": "trending-html"
  },
  {
    "fullName": "abi/screenshot-to-code",
    "url": "https://github.com/abi/screenshot-to-code",
    "description": "Drop in a screenshot and convert it to clean HTML/Tailwind/JS code.",
    "language": "python",
    "stars": 58000,
    "starsInPeriod": 800,
    "forks": 7100,
    "rank": 4,
    "source": "trending-html"
  },
  {
    "fullName": "All-Hands-AI/OpenHands",
    "url": "https://github.com/All-Hands-AI/OpenHands",
    "description": "A platform for software development agents powered by AI.",
    "language": "python",
    "stars": 55000,
    "starsInPeriod": 650,
    "forks": 6200,
    "rank": 5,
    "source": "trending-html"
  },
  {
    "fullName": "zed-industries/zed",
    "url": "https://github.com/zed-industries/zed",
    "description": "Code at the speed of thought - a high-performance multiplayer code editor.",
    "language": "rust",
    "stars": 48000,
    "starsInPeriod": 900,
    "forks": 5200,
    "rank": 6,
    "source": "trending-html"
  },
  {
    "fullName": "tursodatabase/limbo",
    "url": "https://github.com/tursodatabase/limbo",
    "description": "A SQLite-compatible database written in Rust.",
    "language": "rust",
    "stars": 12000,
    "starsInPeriod": 700,
    "forks": 1100,
    "rank": 7,
    "source": "trending-html"
  },
  {
    "fullName": "pocketbase/pocketbase",
    "url": "https://github.com/pocketbase/pocketbase",
    "description": "Open source backend in one file.",
    "language": "go",
    "stars": 42000,
    "starsInPeriod": 450,
    "forks": 1900,
    "rank": 8,
    "source": "trending-html"
  },
  {
    "fullName": "angular/angular",
    "url": "https://github.com/angular/angular",
    "description": "The modern web developer's platform.",
    "language": "typescript",
    "stars": 96000,
    "starsInPeriod": 300,
    "forks": 26000,
    "rank": 9,
    "source": "trending-html"
  },
  {
    "fullName": "vuejs/core",
    "url": "https://github.com/vuejs/core",
    "description": "Vue.js is a progressive, incrementally-adoptable JavaScript framework.",
    "language": "typescript",
    "stars": 48000,
    "starsInPeriod": 280,
    "forks": 12000,
    "rank": 10,
    "source": "trending-html"
  },
  {
    "fullName": "sveltejs/svelte",
    "url": "https://github.com/sveltejs/svelte",
    "description": "Cybernetically enhanced web apps.",
    "language": "javascript",
    "stars": 79000,
    "starsInPeriod": 260,
    "forks": 21000,
    "rank": 11,
    "source": "trending-html"
  },
  {
    "fullName": "honojs/hono",
    "url": "https://github.com/honojs/hono",
    "description": "Fast, lightweight, built on Web Standards.",
    "language": "typescript",
    "stars": 22000,
    "starsInPeriod": 390,
    "forks": 900,
    "rank": 12,
    "source": "trending-html"
  },
  {
    "fullName": "astral-sh/ruff",
    "url": "https://github.com/astral-sh/ruff",
    "description": "An extremely fast Python linter and code formatter, written in Rust.",
    "language": "rust",
    "stars": 33000,
    "starsInPeriod": 420,
    "forks": 1100,
    "rank": 13,
    "source": "trending-html"
  },
  {
    "fullName": "oven-sh/bun",
    "url": "https://github.com/oven-sh/bun",
    "description": "A fast all-in-one JavaScript runtime.",
    "language": "zig",
    "stars": 74000,
    "starsInPeriod": 610,
    "forks": 29000,
    "rank": 14,
    "source": "trending-html"
  },
  {
    "fullName": "ml-explore/mlx",
    "url": "https://github.com/ml-explore/mlx",
    "description": "An array framework for Apple silicon.",
    "language": "swift",
    "stars": 19000,
    "starsInPeriod": 210,
    "forks": 1200,
    "rank": 15,
    "source": "trending-html"
  },
  {
    "fullName": "ggml-org/llama.cpp",
    "url": "https://github.com/ggml-org/llama.cpp",
    "description": "LLM inference in C/C++.",
    "language": "c++",
    "stars": 78000,
    "starsInPeriod": 540,
    "forks": 11000,
    "rank": 16,
    "source": "trending-html"
  },
  {
    "fullName": "ollama/ollama",
    "url": "https://github.com/ollama/ollama",
    "description": "Get up and running with large language models locally.",
    "language": "go",
    "stars": 98000,
    "starsInPeriod": 720,
    "forks": 9000,
    "rank": 17,
    "source": "trending-html"
  },
  {
    "fullName": "langchain-ai/langchain",
    "url": "https://github.com/langchain-ai/langchain",
    "description": "Build context-aware reasoning applications.",
    "language": "python",
    "stars": 95000,
    "starsInPeriod": 480,
    "forks": 13000,
    "rank": 18,
    "source": "trending-html"
  },
  {
    "fullName": "microsoft/generative-ai-for-beginners",
    "url": "https://github.com/microsoft/generative-ai-for-beginners",
    "description": "18 Lessons teaching you how to get started with generative AI.",
    "language": "jupyter",
    "stars": 66000,
    "starsInPeriod": 350,
    "forks": 16000,
    "rank": 19,
    "source": "trending-html"
  },
  {
    "fullName": "public-apis/public-apis",
    "url": "https://github.com/public-apis/public-apis",
    "description": "A collective list of free APIs for use in software development.",
    "language": "python",
    "stars": 320000,
    "starsInPeriod": 1100,
    "forks": 26000,
    "rank": 20,
    "source": "trending-html"
  },
  {
    "fullName": "EbookFoundation/free-programming-books",
    "url": "https://github.com/EbookFoundation/free-programming-books",
    "description": "Freely available programming books.",
    "language": "markdown",
    "stars": 340000,
    "starsInPeriod": 900,
    "forks": 22000,
    "rank": 21,
    "source": "trending-html"
  },
  {
    "fullName": "kamranahmedse/developer-roadmap",
    "url": "https://github.com/kamranahmedse/developer-roadmap",
    "description": "Interactive roadmaps, guides and other educational content.",
    "language": "typescript",
    "stars": 300000,
    "starsInPeriod": 600,
    "forks": 23000,
    "rank": 22,
    "source": "trending-html"
  },
  {
    "fullName": "jwasham/coding-interview-university",
    "url": "https://github.com/jwasham/coding-interview-university",
    "description": "A complete computer science study plan to become a software engineer.",
    "language": "markdown",
    "stars": 310000,
    "starsInPeriod": 420,
    "forks": 24000,
    "rank": 23,
    "source": "trending-html"
  },
  {
    "fullName": "codecrafters-io/build-your-own-x",
    "url": "https://github.com/codecrafters-io/build-your-own-x",
    "description": "Master programming by recreating your favorite technologies from scratch.",
    "language": "markdown",
    "stars": 320000,
    "starsInPeriod": 700,
    "forks": 25000,
    "rank": 24,
    "source": "trending-html"
  },
  {
    "fullName": "sindresorhus/awesome",
    "url": "https://github.com/sindresorhus/awesome",
    "description": "Awesome lists about all kinds of interesting topics.",
    "language": "markdown",
    "stars": 330000,
    "starsInPeriod": 500,
    "forks": 26000,
    "rank": 25,
    "source": "trending-html"
  }
]
